{
  "rfi_id": "CT-2024-123456-12-00-SM01-001",
  "due_date": "2026-03-16",
  "response_date": "2026-03-06",
  "submit_date": "2026-03-05",
  "msc": {
    "country": "Germany"
  },
  "indication": {
    "name": "Type 2 Diabetes Mellitus"
  },
  "considerations": [
    {
      "number": 1,
      "ctr_article": {
        "name": "Part I - Regulatory / Annex I, Section 63"
      },
      "response": {
        "text": "Proof of payment of the additional amount required is provided."
      },
      "outcome": null
    }
  ]
}
